<!ELEMENT CATALOG (PRODUCT+)>
<!ELEMENT PRODUCT (SPECIFICATIONS+, OPTIONS?, PRICE+, NOTES?)>
<!ELEMENT SPECIFICATIONS (#PCDATA)>
<!ELEMENT OPTIONS (#PCDATA)>
<!ELEMENT PRICE (#PCDATA)>
<!ELEMENT NOTES (#PCDATA)>

<!ATTLIST SPECIFICATIONS WEIGHT CDATA #IMPLIED>
<!ATTLIST OPTIONS FINISH (Metal | Matte) "Matte">
<!ATTLIST OPTIONS CASE (HardShell | Soft | NotApplicable) "HardShell">
<!ATTLIST PRICE CURRENCY CDATA "USD">
<!ATTLIST PRICE SHIPPING CDATA #IMPLIED>